{
  "schema_version": "1.0",
  "decision": {
    "type": "action_proposed",
    "summary": "Перезапустить тестовый worker-сервис через ранбук System Center.",
    "confidence": 0.82
  },
  "operator_message": "Проверьте предложенный ранбук перед выполнением.",
  "internal_reasoning_summary": "Симптомы совпадают с известной проблемой worker-компонента, где допустим запуск операции восстановления.",
  "citations": [],
  "proposed_actions": [
    {
      "tool_name": "start_systemcenter_runbook",
      "action_id": "restart_billing_worker_test",
      "action_type": "action",
      "parameters": {
        "runbook_code": "restart_service",
        "app_name": "billing-worker"
      },
      "reason": "Worker не обрабатывает задания, и этот ранбук является известным способом восстановления.",
      "risk_level": "medium",
      "expected_effect": "Для billing-worker будет запущена настроенная операция восстановления.",
      "requires_state_change": true,
      "risk_notes": "Перезапуск может прервать активные тестовые задания."
    }
  ]
}
