{
  "schema_version": "1.0",
  "decision": {
    "type": "clarification_needed",
    "missing_fields": [
      "app_name"
    ],
    "question": "Уточните приложение или компонент, для которого нужно выполнить диагностику.",
    "confidence": 0.91
  },
  "operator_message": "Запросите приложение или компонент перед продолжением.",
  "internal_reasoning_summary": "В заявке отсутствуют обязательные поля маршрутизации.",
  "citations": [],
  "proposed_actions": []
}
